Command,Link,Description,Preprocessed_Description
show ip igmp,https://www.arubanetworks.com/techdocs/CLI-Bank/Content/aos10/sh-ip-igmp.htm,This command displays IGMP group table.,igmp group table
show ip igmp config,https://www.arubanetworks.com/techdocs/CLI-Bank/Content/aos10/sh-ip-igmp-cnfg.htm,This command displays the current IGMP configuration.,current igmp configuration
show ip igmp counters,https://www.arubanetworks.com/techdocs/CLI-Bank/Content/aos10/sh-ip-igmp-cntr.htm,This command displays the list of counters for the following IGMP queries:,list counters following igmp queries
show ip igmp group,https://www.arubanetworks.com/techdocs/CLI-Bank/Content/aos10/sh-ip-igmp-grp.htm,This command displays the IGMP group table.,igmp group table
show ip igmp interface,https://www.arubanetworks.com/techdocs/CLI-Bank/Content/aos10/sh-ip-igmp-intrfc.htm,This command displays IGMP interface table for all VLANs on Gateway device.,igmp interface table vlans gateway device
show ip igmp proxy group,https://www.arubanetworks.com/techdocs/CLI-Bank/Content/aos10/sh-ip-igmp-pxy-grp.htm,This command displays the IGMP proxy group information for a specific interface.,igmp proxy group information specific interface
show ip igmp proxy-mobility-group,https://www.arubanetworks.com/techdocs/CLI-Bank/Content/aos10/sh-ip-igmp-pxy-mb-grp.htm,Displays the IGMP proxy group information stored for mobile clients that are away from the managed device.,igmp proxy group information stored mobile clients away managed device
show ip igmp proxy mobility stats,https://www.arubanetworks.com/techdocs/CLI-Bank/Content/aos10/sh-ip-igmp-prxy-mob-sts.htm,This command displays information on IGMP mobility multicast statistics.,information igmp mobility multicast statistics
show ip igmp proxy stats,https://www.arubanetworks.com/techdocs/CLI-Bank/Content/aos10/sh-ip-igmp-prxy-sts.htm,This command displays the number of messages transmitted and received by the IGMP proxy on the upstream interface.,number messages transmitted received igmp proxy upstream interface
show ip interface brief,https://www.arubanetworks.com/techdocs/CLI-Bank/Content/aos10/sh-ip-intfc-brf.htm,This command displays the IP-related information on all interfaces in summary format.,information interfaces summary format
show ip mobile active-domains,https://www.arubanetworks.com/techdocs/CLI-Bank/Content/aos10/sh-ip-mobile.htm,This command displays the IP mobility domains active on the switch.,ip mobility domains active switch
show ip mobile binding,https://www.arubanetworks.com/techdocs/CLI-Bank/Content/aos10/sh-ip-mobile-bndgs.htm,This command displays the list of home agent binding information for the mobile protocol.,list home agent binding information mobile protocol
show ip mobile domian,https://www.arubanetworks.com/techdocs/CLI-Bank/Content/aos10/sh-ip-mobile-dmn.htm,"This command displays the subnet, VLAN, and home agent information for all mobility domains. You can specify a mobility domain name to view data only for that particular domain.",subnet vlan home agent information mobility domains specify mobility domain name view data particular domain
show ip mobile global,https://www.arubanetworks.com/techdocs/CLI-Bank/Content/aos10/sh-ip-mobile-gbl.htm,This command displays the current mobility agents global configuration.,current mobility agents global configuration
show ip mobile hat,https://www.arubanetworks.com/techdocs/CLI-Bank/Content/aos10/sh-ip-mobile-hat.htm,This command displays the active home agent table.,active home agent table
show ip mobile host,https://www.arubanetworks.com/techdocs/CLI-Bank/Content/aos10/sh-ip-mobile-host.htm,This command displays the list of mobile IP hosts.,list mobile ip hosts
show ip mobile multicast-vlan-table,https://www.arubanetworks.com/techdocs/CLI-Bank/Content/aos10/sh-ip-mob-mtcst-vlan.htm,This command displays the mobility multicast VLAN table information.,mobility multicast vlan table information
show ip mobile traffic,https://www.arubanetworks.com/techdocs/CLI-Bank/Content/aos10/sh-ip-mobile-trfc.htm,This command displays the mobile IP protocol statistics for the following:,mobile ip protocol statistics following
show ip mobile tunnel,https://www.arubanetworks.com/techdocs/CLI-Bank/Content/aos10/a10-sh-ip-mob-tnl.htm,This command displays statistics and configuration information for the Mobile Tunnel.,statistics configuration information mobile tunnel
show ip mobile visitor,https://www.arubanetworks.com/techdocs/CLI-Bank/Content/aos10/a10-sh-ip-mob-visit.htm,This command displays statistics and configuration information for the mobile nodes visiting a foreign agent.,statistics configuration information mobile nodes visiting foreign agent
show ip nexthop-list,https://www.arubanetworks.com/techdocs/CLI-Bank/Content/aos10/sh-ip-nexthop-ls.htm,"This command displays the next hop list settings for policy-based routing. A next hop IP is the IP address of a adjacent router or device with layer-2 connectivity to the Gateway. The next hop list provides redundancy for the next hop devices by forwarding the traffic to a backup next hop device in case of failures. If active next hop device on the list becomes unreachable, traffic matching a policy-based routing ACL is forwarded using the highest-priority active next hop on the list.",next hop list settings routing next hop ip ip address adjacent router device connectivity gateway next hop list provides redundancy next hop devices forwarding traffic backup next hop device case failures active next hop device list becomes unreachable traffic matching routing acl forwarded using active next hop list
show ip oap,https://www.arubanetworks.com/techdocs/CLI-Bank/Content/aos10/sh-ip-oap.htm,This command displays OAP information.,oap information
show ip oap advertise,https://www.arubanetworks.com/techdocs/CLI-Bank/Content/aos10/a10-sh-ip-oap-advert.htm,"This command displays the received configuration from the Mobility Conductor. Issue this command to view the entire configuration saved on the gateway, including all profiles, ACLs, and interface settings.",received configuration mobility conductor issue view entire configuration saved gateway including profiles acls interface settings
show ip oap advertise verbose,https://www.arubanetworks.com/techdocs/CLI-Bank/Content/aos10/a10-sh-ip-oap-advert-verb.htm,This command displays the advertised IP OAP tunnels information that can be used for debugging.,advertised ip oap tunnels information used debugging
show ip oap hub-mesh nexthops,https://www.arubanetworks.com/techdocs/CLI-Bank/Content/aos10/a10-sh-ip-oap-msh-nxthops.htm,This command displays information about the hub-mesh nexthops.,information nexthops
show ip oap hub-mesh nodes,https://www.arubanetworks.com/techdocs/CLI-Bank/Content/aos10/a10-sh-ip-oap-msh-nodes.htm,This command displays information about the hub-mesh nodes.,information nodes
show ip oap hub-mesh topology,https://www.arubanetworks.com/techdocs/CLI-Bank/Content/aos10/a10-sh-ip-oap-msh-topo.htm,This command displays information about the hub-mesh topology.,information topology
show ip oap route,https://www.arubanetworks.com/techdocs/CLI-Bank/Content/aos10/a10-sh-ip-oap-route.htm,This command displays information about an Overlay Agent Protocol route.,information overlay agent protocol route
show ip oap route all verbose,https://www.arubanetworks.com/techdocs/CLI-Bank/Content/aos10/a10-sh-ip-oap-route-all-verb.htm,This command displays information about all the Overlay Agent Protocol routes.,information overlay agent protocol routes
show ip oap tunnel,https://www.arubanetworks.com/techdocs/CLI-Bank/Content/aos10/a10-sh-ip-oap-tnl.htm,This command displays information about the Overlay Agent Protocol tunnel.,information overlay agent protocol tunnel
show ip ospf,https://www.arubanetworks.com/techdocs/CLI-Bank/Content/aos10/sh-ip-ospf.htm,This command display statistics and configuration information for the OSPF routing protocol for a gateway.,display statistics configuration information ospf routing protocol gateway
show ip ospf database,https://www.arubanetworks.com/techdocs/CLI-Bank/Content/aos10/sh-ip-ospf-db.htm,This command displays the statistics and configuration information for the OSPF routing protocol for a gateway.,statistics configuration information ospf routing protocol gateway
show ip ospf interface,https://www.arubanetworks.com/techdocs/CLI-Bank/Content/aos10/sh-ip-ospf-interface.htm,This command displays the statistics and configuration information for the OSPF routing protocol for a gateway interface.,statistics configuration information ospf routing protocol gateway interface
show ip ospf neighbor,https://www.arubanetworks.com/techdocs/CLI-Bank/Content/aos10/sh-ip-ospf-neighbor.htm,This command displays the statistics and configuration information for the OSPF routing protocol for a neighbor gateway.,statistics configuration information ospf routing protocol neighbor gateway
show ip pim group,https://www.arubanetworks.com/techdocs/CLI-Bank/Content/aos10/sh-ip-pim-group.htm,This command displays the multicast group membership table.,multicast group membership table
show ip pim statistics,https://www.arubanetworks.com/techdocs/CLI-Bank/Content/aos10/sh-ip-pim-statistics.htm,This command displays the multicast PIM statistics in a Gateway device.,multicast pim statistics gateway device
show ip pppoe-info,https://www.arubanetworks.com/techdocs/CLI-Bank/Content/aos10/sh-ip-pppoe-info.htm,This command displays the configuration settings for PPPoE.,configuration settings pppoe
show ip prefix-list,https://www.arubanetworks.com/techdocs/CLI-Bank/Content/aos10/sh-ip-prefix.htm,This command displays the information about a prefix list or prefix list entries for the Gateways.,information prefix list prefix list entries gateways
show ip probe,https://www.arubanetworks.com/techdocs/CLI-Bank/Content/aos10/sh-ip-probe.htm,"This command displays the health-check profile settings for measuring WAN reachability and latency on a gateway uplink, and the default probe profile settings for PBR using next-hop lists.",profile settings measuring wan reachability latency gateway uplink default probe profile settings pbr using lists
show ip radius source-interface,https://www.arubanetworks.com/techdocs/CLI-Bank/Content/aos10/sh-ip-radius.htm,This command displays the global parameters for configured RADIUS servers and the source interface address of outgoing RADIUS requests for a gateway.,global parameters configured radius servers source interface address outgoing radius requests gateway
show ip-reputation,https://www.arubanetworks.com/techdocs/CLI-Bank/Content/aos10/a10-sh-ip-rep.htm,This command displays the IP reputation status.,ip reputation status
show ip rip,https://www.arubanetworks.com/techdocs/CLI-Bank/Content/aos10/sh-ip-rip.htm,This command displays the statistics and configuration information of the Routing Information Protocol (RIP) for a gateway.,statistics configuration information routing information protocol rip gateway
show ip rip interface,https://www.arubanetworks.com/techdocs/CLI-Bank/Content/aos10/sh-ip-rip-intrfc.htm,This command displays the RIP interface information from a specified gateway.,rip interface information specified gateway
show ip rip neighbors,https://www.arubanetworks.com/techdocs/CLI-Bank/Content/aos10/sh-ip-rip-nghbrs.htm,This command displays the RIP neighbor information from a specified gateway.,rip neighbor information specified gateway
show ip route,https://www.arubanetworks.com/techdocs/CLI-Bank/Content/aos10/sh-ip-route.htm,This command displays the Mobility Master routing table with static routes configured on the Mobility Master.,mobility master routing table static routes configured mobility master
show ip route counters,https://www.arubanetworks.com/techdocs/CLI-Bank/Content/aos10/sh-ip-route-counter.htm,"This command displays the number of routes present in a gateway, categorized by type.",number routes present gateway categorized type
show ip vrf,https://www.arubanetworks.com/techdocs/CLI-Bank/Content/aos10/a10-sh-ip-vrf.htm,This command displays information on Virtual Routing and Forwarding (VRF) instances running on the Gateway.,information virtual routing forwarding vrf instances running gateway
show ipv6 dhcp database,https://www.arubanetworks.com/techdocs/CLI-Bank/Content/aos10/a10-sh-ipv6-dhcp-dbs.htm,This command displays the DHCPv6 server settings.,dhcpv6 server settings
show ipv6 firewall,https://www.arubanetworks.com/techdocs/CLI-Bank/Content/aos10/sh-ipv6-firewall.htm,This command displays the status of all the IPv6 firewall configurations available in a gateway.,status ipv6 firewall configurations available gateway
show ipv6 global,https://www.arubanetworks.com/techdocs/CLI-Bank/Content/aos10/sh-v6-global.htm,This command displays IPv6 global config information on a gateway.,ipv6 global config information gateway
show ipv6 interface,https://www.arubanetworks.com/techdocs/CLI-Bank/Content/aos10/sh-v6-interface.htm,This command displays the usability status of all interfaces configured for IPv6 on a gateway.,usability status interfaces configured ipv6 gateway
show ipv6 mld config,https://www.arubanetworks.com/techdocs/CLI-Bank/Content/aos10/sh-v6-mld-config.htm,This command displays the Multicast Listener Discovery (MLD) configuration details of a gateway.,multicast listener discovery mld configuration details gateway
show ipv6 mld counters,https://www.arubanetworks.com/techdocs/CLI-Bank/Content/aos10/sh-v6-mld-countr.htm,This command displays the statistics of Multicast Listener Discovery (MLD) interface counters in a gateway.,statistics multicast listener discovery mld interface counters gateway
show ipv6 mld group,https://www.arubanetworks.com/techdocs/CLI-Bank/Content/aos10/sh-ipv6-mld-grp.htm,This command displays the details of the Multicast Listener Discovery (MLD) group. It shows the multicast groups that are directly connected to the router and that were identified through MLD.,details multicast listener discovery mld group shows multicast groups directly connected router identified mld
show ipv6 mld interface,https://www.arubanetworks.com/techdocs/CLI-Bank/Content/aos10/sh-v6-mld-intf.htm,This command displays multicast-related information about a gateway interface.,information gateway interface
show ipv6 mld proxy-group,https://www.arubanetworks.com/techdocs/CLI-Bank/Content/aos10/sh-v6-mld-prx-gr.htm,This command displays the MLD proxy group details of a gateway.,mld proxy group details gateway
show ipv6 mld proxy-mobility-group,https://www.arubanetworks.com/techdocs/CLI-Bank/Content/aos10/sh-v6-mprx-mbgrp.htm,This command displays the MLD proxy-mobility-group details of a gateway.,mld details gateway
show ipv6 mld proxy-mobility-stats,https://www.arubanetworks.com/techdocs/CLI-Bank/Content/aos10/sh-v6-mprx-mbsts.htm,This command displays the details of MLD proxy-mobility statistics of a gateway.,details mld statistics gateway
show ipv6 mld proxy-stats,https://www.arubanetworks.com/techdocs/CLI-Bank/Content/aos10/sh-v6-mprx-stt.htm,This command displays the status of the MLD proxy of a gateway.,status mld proxy gateway
show ipv6 neighbors,https://www.arubanetworks.com/techdocs/CLI-Bank/Content/aos10/sh-v6-neighb.htm,This command displays the IPv6 neighbors configured on a VLAN interface. This command shows IPv6 neighbor discovery (ND) cache information on a VLAN interface via the ipv6 neighbor command.,ipv6 neighbors configured vlan interface shows ipv6 neighbor discovery nd cache information vlan interface via ipv6 neighbor
show ipv6 ra,https://www.arubanetworks.com/techdocs/CLI-Bank/Content/aos10/sh-v6-ra-proxy.htm,This command displays the RA proxy server information and IPv6 RA.,ra proxy server information ipv6 ra
show ipv6 route,https://www.arubanetworks.com/techdocs/CLI-Bank/Content/aos10/sh-v6-route.htm,"This command displays the IPv6 routing table, also displays the static IPv6 routes configured on the gateway.",ipv6 routing table also static ipv6 routes configured gateway
show iostat,https://www.arubanetworks.com/techdocs/CLI-Bank/Content/aos10/sh-iostat.htm,This command displays Input/Output statistics information. This command reports Central Processing Unit (CPU) statistics and Input/Output statistics for devices and partitions.,statistics information reports central processing unit cpu statistics statistics devices partitions
show keys,https://www.arubanetworks.com/techdocs/CLI-Bank/Content/aos10/a10-sh-keys.htm,This command displays if optional keys and features are enabled or disabled on the Gateway.,optional keys features enabled disabled gateway
show lacp,https://www.arubanetworks.com/techdocs/CLI-Bank/Content/aos10/sh-lacp.htm,This command displays the Link Aggregation Control Protocol (LACP) configuration status.,link aggregation control protocol lacp configuration status
show lacp status,https://www.arubanetworks.com/techdocs/CLI-Bank/Content/aos10/a10-sh-lacp-stat.htm,This command displays the Link Aggregation Control Protocol (LACP) configuration status.,link aggregation control protocol lacp configuration status
show lc-cluster exclude-vlan,https://www.arubanetworks.com/techdocs/CLI-Bank/Content/aos10/a10-sh-lc-clstr-ex-vlan.htm,This command displays the VLANs excluded from probing.,vlans excluded probing
show lc-cluster group-membership,https://www.arubanetworks.com/techdocs/CLI-Bank/Content/aos10/sh-lc-clust-grp-mem.htm,This command displays information related to group membership for a gateway cluster. It shows the active cluster member of a gateway cluster profile.,information related group membership gateway cluster shows active cluster member gateway cluster profile
show lc-cluster group profile,https://www.arubanetworks.com/techdocs/CLI-Bank/Content/aos10/sh-lc-clstr-pro.htm,This command displays information related to the gateway cluster profile.,information related gateway cluster profile
show lc-cluster gsm counters,https://www.arubanetworks.com/techdocs/CLI-Bank/Content/aos10/a10-sh-lc-clstr-gsm.htm,This command displays the counters pertaining to various GSM events.,counters pertaining various gsm events
show lc-cluster heartbeat counters,https://www.arubanetworks.com/techdocs/CLI-Bank/Content/aos10/a10-sh-lc-clstr-heartbeat.htm,This command displays the cluster heartbeat counters.,cluster heartbeat counters
show lc-cluster history,https://www.arubanetworks.com/techdocs/CLI-Bank/Content/aos10/a10-sh-lc-clstr-hist.htm,This command displays the cluster history.,cluster history
show lc-cluster load distribution ap,https://www.arubanetworks.com/techdocs/CLI-Bank/Content/aos10/sh-lc-clstr-ap.htm,This command displays information related to the current load distribution on the AP.,information related current load distribution ap
show lc-cluster load distribution client,https://www.arubanetworks.com/techdocs/CLI-Bank/Content/aos10/sh-lc-clstr-clnt.htm,This command displays information related to the current load distribution on the gateway cluster client.,information related current load distribution gateway cluster client
show lc-cluster papi counters,https://www.arubanetworks.com/techdocs/CLI-Bank/Content/aos10/a10-sh-lc-clstr-papi.htm,This command displays the cluster PAPI counters.,cluster papi counters
show lc-cluster vlan-probe,https://www.arubanetworks.com/techdocs/CLI-Bank/Content/aos10/sh-lc-clstr-stat.htm,This command displays information related to vlan probe for a gateway cluster. It shows the active cluster member of a gateway cluster profile.,information related vlan probe gateway cluster shows active cluster member gateway cluster profile
show lldp interface,https://www.arubanetworks.com/techdocs/CLI-Bank/Content/aos10/sh-lldp-intf.htm,This command displays the LLDP interfaces information.,lldp interfaces information
show lldp neighbor,https://www.arubanetworks.com/techdocs/CLI-Bank/Content/aos10/sh-lldp-neighbor.htm,This command displays information about LLDP peers and traffic information for the neighboring gateway.,information lldp peers traffic information neighboring gateway
show lldp statistics,https://www.arubanetworks.com/techdocs/CLI-Bank/Content/aos10/sh-lldp-stats.htm,"This command displays the LLDP statistics information of a gateway. By default, this command displays LLDP statistics for the entire list of LLDP interfaces.",lldp statistics information gateway default lldp statistics entire list lldp interfaces
show lhm status,https://www.arubanetworks.com/techdocs/CLI-Bank/Content/aos10/a10-sh-lhm.htm,"This command displays the number of times the policies configured on an AP have run. If there are no policies configured on the AP, the status shows up as Empty in this command output.",number times policies configured ap run policies configured ap status shows empty output
show license client-table,https://www.arubanetworks.com/techdocs/CLI-Bank/Content/aos10/a10-sh-lic-cltbl.htm,This command when executed from the CLI of a managed device to view license limits applied to that managed device from its licensing pool.,executed cli managed device view license limits applied managed device licensing pool
show license debug,https://www.arubanetworks.com/techdocs/CLI-Bank/Content/aos10/a10-sh-lic-db.htm,This command displays a summary of Mobility Master's licensing role and IP address.,summary mobility master licensing role ip address
show license heartbeat stats,https://www.arubanetworks.com/techdocs/CLI-Bank/Content/aos10/a10-sh-lic-hrtbts.htm,This command displays the license heartbeat statistics between the centralized licensing server and the license client.,license heartbeat statistics centralized licensing server license client
show license verbose,https://www.arubanetworks.com/techdocs/CLI-Bank/Content/aos10/a10-sh-lic-vbr.htm,This command displays verbose output.,verbose output
show loginsessions,https://www.arubanetworks.com/techdocs/CLI-Bank/Content/aos10/sh-loginsess.htm,This command displays the current administrator login sessions statistics.,current administrator login sessions statistics
show log all,https://www.arubanetworks.com/techdocs/CLI-Bank/Content/aos10/sh-log-all.htm,This command displays the log files of a gateway.,log files gateway
show log all | include central,https://www.arubanetworks.com/techdocs/CLI-Bank/Content/aos10/a10-sh-log-all-include-central.htm,This command displays all the logs for the gateway that includes Central as the keyword.,logs gateway includes central keyword
show log ap-debug,https://www.arubanetworks.com/techdocs/CLI-Bank/Content/aos10/sh-log-usr-dbg.htm,This command displays the controller’s AP debug logs.,controller ap debug logs
show log arm all,https://www.arubanetworks.com/techdocs/CLI-Bank/Content/aos10/sh-log-arm-usr.htm,This command displays the gateway's ARM user debug logs.,gateway arm user debug logs
show log arm-user-debug all,https://www.arubanetworks.com/techdocs/CLI-Bank/Content/aos10/sh-log-arm-dbg.htm,This command displays the gateway’s ARM user debug logs.,gateway arm user debug logs
show log convert,https://www.arubanetworks.com/techdocs/CLI-Bank/Content/aos10/sh-log-convert.htm,This command displays image conversion details for the AP.,image conversion details ap
show log debug,https://www.arubanetworks.com/techdocs/CLI-Bank/Content/aos10/sh-log-debug.htm,This command shows the AP full log. It displays the log output from the specified number of lines from the end of the log.,shows ap full log log output specified number lines end log
show log driver,https://www.arubanetworks.com/techdocs/CLI-Bank/Content/aos10/sh-log-driver.htm,This command displays the status of drivers configured on the AP.,status drivers configured ap
show log errorlog,https://www.arubanetworks.com/techdocs/CLI-Bank/Content/aos10/sh-log_error.htm,This command displays the gateway’s system errors and other critical information. It shows all the error logs for the gateway.,gateway system errors critical information shows error logs gateway
show log kernel,https://www.arubanetworks.com/techdocs/CLI-Bank/Content/aos10/show_log_kernel.htm,This command displays AP’s kernel logs.,ap kernel logs
show log l3-mobility,https://www.arubanetworks.com/techdocs/CLI-Bank/Content/aos10/sh-log-l3mobil.htm,This command displays the logs for Layer-3 mobility domains configured on an Instant AP.,logs mobility domains configured instant ap
show log network,https://www.arubanetworks.com/techdocs/CLI-Bank/Content/aos10/sh-log-ntwk.htm,This command displays the AP's system network errors. It shows the log output from the specified number of lines from the end of the log.,ap system network errors shows log output specified number lines end log
show log network all,https://www.arubanetworks.com/techdocs/CLI-Bank/Content/aos10/sh-log-ntwk-all.htm,This command shows all the system network errors of a gateway.,shows system network errors gateway
show log openflow,https://www.arubanetworks.com/techdocs/CLI-Bank/Content/aos10/sh-log-openflow.htm,This command displays the OpenFlow logs of an Instant AP.,openflow logs instant ap
show log pppd,https://www.arubanetworks.com/techdocs/CLI-Bank/Content/aos10/show-log-pppd.htm,This command displays the PPPd network connection details.,pppd network connection details
show log provision,https://www.arubanetworks.com/techdocs/CLI-Bank/Content/aos10/a10-show_log_provision.htm,This command displays logs related to provision process and corresponding communication with Activate.,logs related provision process corresponding communication activate
show log rapper,https://www.arubanetworks.com/techdocs/CLI-Bank/Content/aos10/show-log-rapper.htm,This command shows the details of VPN connection logs in detail.,shows details vpn connection logs detail
show log rtls-to-cloud,https://www.arubanetworks.com/techdocs/CLI-Bank/Content/aos10/sh-log-rtls-clo.htm,This command displays the logs generated for the RTLS tags sent to Central.,logs generated rtls tags sent central
